{
  "$schema": "https://json-schema.org/draft/2020-12/schema",
  "$id": "https://waywey.gobleuer.com/schemas/routes.schema.json",
  "title": "WayWey hospital routes",
  "type": "object",
  "required": [
    "graph",
    "pavilionLabels",
    "noteTranslations",
    "specialRoutes"
  ],
  "properties": {
    "graph": {
      "type": "object",
      "additionalProperties": {
        "type": "array",
        "items": {
          "type": "string"
        },
        "uniqueItems": true
      }
    },
    "pavilionLabels": {
      "type": "object",
      "minProperties": 1,
      "additionalProperties": {
        "type": "object",
        "additionalProperties": {
          "type": "string"
        }
      }
    },
    "noteTranslations": {
      "type": "object",
      "additionalProperties": {
        "type": "object",
        "additionalProperties": {
          "type": "string"
        }
      }
    },
    "specialRoutes": {
      "type": "object",
      "additionalProperties": {
        "type": "object",
        "additionalProperties": {
          "type": "array",
          "minItems": 1,
          "items": {
            "type": "string",
            "minLength": 1
          }
        }
      }
    },
    "routingNotes": {
      "type": "object",
      "additionalProperties": {
        "type": "string"
      }
    }
  },
  "additionalProperties": false
}
